{
  "resource": {
    "serviceName": "iris-macos",
    "deviceName": "Johannes' MacBook Pro",
    "appVersion": "1.0.0"
  },
  "spans": [],
  "logs": [
    {
      "timestamp": "2026-10-27T12:05:00.125Z",
      "severity": "error",
      "body": "sse.disconnected",
      "attributes": {
        "retryInSeconds": 5
      }
    }
  ],
  "dropped": 0
}
