{
  "resource": {
    "serviceName": "iris-ios",
    "deviceName": "Johannes' iPhone",
    "appVersion": "1.0.0"
  },
  "spans": [
    {
      "traceId": "0f8fad5bd9cb469fa16570867728950e",
      "spanId": "00000000000000a1",
      "name": "capture",
      "startTime": "2026-10-27T12:00:00.000Z",
      "endTime": "2026-10-27T12:00:42.500Z",
      "status": "ok",
      "attributes": {}
    },
    {
      "traceId": "0f8fad5bd9cb469fa16570867728950e",
      "spanId": "00000000000000a2",
      "parentSpanId": "00000000000000a1",
      "name": "segment.upload",
      "startTime": "2026-10-27T12:00:10.250Z",
      "endTime": "2026-10-27T12:00:11.750Z",
      "status": "error",
      "attributes": {
        "segment": 1,
        "attempt": 2,
        "cached": false,
        "ratio": 0.5,
        "route": "audio/m4a"
      }
    }
  ],
  "logs": [
    {
      "timestamp": "2026-10-27T12:00:11.800Z",
      "severity": "warn",
      "body": "outbox.retry",
      "traceId": "0f8fad5bd9cb469fa16570867728950e",
      "attributes": {
        "segment": 1,
        "reason": "timeout"
      }
    },
    {
      "timestamp": "2026-10-27T12:00:30.000Z",
      "severity": "info",
      "body": "app.foreground",
      "attributes": {}
    }
  ],
  "dropped": 3
}
